{
  "schema_id": "naturalcontrol.actuation_bundle.v1.1",
  "spec_version": "1.1",
  "epoch_ns": "1742050000010000000",
  "bundle_id": "bundle-011",
  "request_id": "req-click-001",
  "interaction_id": "interaction-blueclicker-001",
  "execution_id": "exec-001",
  "surface_kind": "mouse",
  "time_basis": "relative_to_interaction_epoch_ns",
  "surface_profile_ref": "surface/mouse/default-v1",
  "adapter_ref": "adapter/uinput-v1",
  "atoms": [
    {
      "atom_id": "atom-011-1",
      "offset_ns": "0",
      "duration_ns": "8000000",
      "kind": "pointer_delta",
      "channel": "pointer",
      "payload": {
        "dx": 18,
        "dy": -4
      },
      "source_segment": "segment-001"
    },
    {
      "atom_id": "atom-011-2",
      "offset_ns": "8000000",
      "duration_ns": "1000000",
      "kind": "pointer_button",
      "channel": "button",
      "payload": {
        "button": "left",
        "state": "press"
      },
      "source_segment": "segment-001"
    },
    {
      "atom_id": "atom-011-3",
      "offset_ns": "9000000",
      "duration_ns": "1000000",
      "kind": "pointer_button",
      "channel": "button",
      "payload": {
        "button": "left",
        "state": "release"
      },
      "source_segment": "segment-001"
    }
  ]
}
